{
  "envelope_version": "1.0.0",
  "record_kind": "event",
  "record_stage": "normalized",
  "record_id": "rec_001",
  "record_ts": "2026-04-13T18:00:00.000Z",
  "source": {
    "source_id": "mock-source",
    "source_type": "sync_api",
    "source_record_id": "src-001"
  },
  "provenance": {
    "ingested_at": "2026-04-13T18:00:00.000Z",
    "processed_at": "2026-04-13T18:00:01.000Z",
    "processor": "mock-adapter",
    "method": "rule"
  },
  "canonical": {
    "event_type": "identity_touch",
    "subject_entity_id": "entity-001"
  }
}
